{
  "schema": "zenodex/tau/behavior-atlas/v1",
  "spec_id": "autotrader_tx_envelope_guard_v1",
  "spec_path": "src/tau_specs/recommended/autotrader_tx_envelope_guard_v1.tau",
  "contract_ref": "formal/tau/contracts/autotrader_tx_envelope_guard_v1.contract.json",
  "atlas_status": "active",
  "proof_scope": "bounded_assurance_domain",
  "domain_hash": "6ecb9a954cbbb6f024c9241e6d44f8802dbfa6c41a7dde3fb3c1363878993b66",
  "output_order": [
    "o1",
    "o2",
    "o3",
    "o4"
  ],
  "regions": [
    {
      "region_id": "0000",
      "output_vector": {
        "o1": 0,
        "o2": 0,
        "o3": 0,
        "o4": 0
      },
      "reachability_status": "reachable",
      "region_formula": "o1=0 && o2=0 && o3=0 && o4=0",
      "proof_refs": [
        "bounded_enumeration:case_256"
      ],
      "witness_inputs": {
        "i1": 1,
        "i2": 0,
        "i3": 0,
        "i4": 0,
        "i5": 0,
        "i6": 0,
        "i7": 0,
        "i8": 0,
        "i9": 0
      }
    },
    {
      "region_id": "0001",
      "output_vector": {
        "o1": 0,
        "o2": 0,
        "o3": 0,
        "o4": 1
      },
      "reachability_status": "unreachable",
      "region_formula": "o1=0 && o2=0 && o3=0 && o4=1",
      "proof_refs": [
        "bounded_enumeration:no_case_in_explicit_domain"
      ]
    },
    {
      "region_id": "0010",
      "output_vector": {
        "o1": 0,
        "o2": 0,
        "o3": 1,
        "o4": 0
      },
      "reachability_status": "reachable",
      "region_formula": "o1=0 && o2=0 && o3=1 && o4=0",
      "proof_refs": [
        "bounded_enumeration:case_263"
      ],
      "witness_inputs": {
        "i1": 1,
        "i2": 0,
        "i3": 0,
        "i4": 0,
        "i5": 0,
        "i6": 0,
        "i7": 1,
        "i8": 1,
        "i9": 1
      }
    },
    {
      "region_id": "0011",
      "output_vector": {
        "o1": 0,
        "o2": 0,
        "o3": 1,
        "o4": 1
      },
      "reachability_status": "unreachable",
      "region_formula": "o1=0 && o2=0 && o3=1 && o4=1",
      "proof_refs": [
        "bounded_enumeration:no_case_in_explicit_domain"
      ]
    },
    {
      "region_id": "0100",
      "output_vector": {
        "o1": 0,
        "o2": 1,
        "o3": 0,
        "o4": 0
      },
      "reachability_status": "reachable",
      "region_formula": "o1=0 && o2=1 && o3=0 && o4=0",
      "proof_refs": [
        "bounded_enumeration:case_312"
      ],
      "witness_inputs": {
        "i1": 1,
        "i2": 0,
        "i3": 0,
        "i4": 1,
        "i5": 1,
        "i6": 1,
        "i7": 0,
        "i8": 0,
        "i9": 0
      }
    },
    {
      "region_id": "0101",
      "output_vector": {
        "o1": 0,
        "o2": 1,
        "o3": 0,
        "o4": 1
      },
      "reachability_status": "unreachable",
      "region_formula": "o1=0 && o2=1 && o3=0 && o4=1",
      "proof_refs": [
        "bounded_enumeration:no_case_in_explicit_domain"
      ]
    },
    {
      "region_id": "0110",
      "output_vector": {
        "o1": 0,
        "o2": 1,
        "o3": 1,
        "o4": 0
      },
      "reachability_status": "reachable",
      "region_formula": "o1=0 && o2=1 && o3=1 && o4=0",
      "proof_refs": [
        "bounded_enumeration:case_319"
      ],
      "witness_inputs": {
        "i1": 1,
        "i2": 0,
        "i3": 0,
        "i4": 1,
        "i5": 1,
        "i6": 1,
        "i7": 1,
        "i8": 1,
        "i9": 1
      }
    },
    {
      "region_id": "0111",
      "output_vector": {
        "o1": 0,
        "o2": 1,
        "o3": 1,
        "o4": 1
      },
      "reachability_status": "unreachable",
      "region_formula": "o1=0 && o2=1 && o3=1 && o4=1",
      "proof_refs": [
        "bounded_enumeration:no_case_in_explicit_domain"
      ]
    },
    {
      "region_id": "1000",
      "output_vector": {
        "o1": 1,
        "o2": 0,
        "o3": 0,
        "o4": 0
      },
      "reachability_status": "reachable",
      "region_formula": "o1=1 && o2=0 && o3=0 && o4=0",
      "proof_refs": [
        "bounded_enumeration:case_448"
      ],
      "witness_inputs": {
        "i1": 1,
        "i2": 1,
        "i3": 1,
        "i4": 0,
        "i5": 0,
        "i6": 0,
        "i7": 0,
        "i8": 0,
        "i9": 0
      }
    },
    {
      "region_id": "1001",
      "output_vector": {
        "o1": 1,
        "o2": 0,
        "o3": 0,
        "o4": 1
      },
      "reachability_status": "unreachable",
      "region_formula": "o1=1 && o2=0 && o3=0 && o4=1",
      "proof_refs": [
        "bounded_enumeration:no_case_in_explicit_domain"
      ]
    },
    {
      "region_id": "1010",
      "output_vector": {
        "o1": 1,
        "o2": 0,
        "o3": 1,
        "o4": 0
      },
      "reachability_status": "reachable",
      "region_formula": "o1=1 && o2=0 && o3=1 && o4=0",
      "proof_refs": [
        "bounded_enumeration:case_455"
      ],
      "witness_inputs": {
        "i1": 1,
        "i2": 1,
        "i3": 1,
        "i4": 0,
        "i5": 0,
        "i6": 0,
        "i7": 1,
        "i8": 1,
        "i9": 1
      }
    },
    {
      "region_id": "1011",
      "output_vector": {
        "o1": 1,
        "o2": 0,
        "o3": 1,
        "o4": 1
      },
      "reachability_status": "unreachable",
      "region_formula": "o1=1 && o2=0 && o3=1 && o4=1",
      "proof_refs": [
        "bounded_enumeration:no_case_in_explicit_domain"
      ]
    },
    {
      "region_id": "1100",
      "output_vector": {
        "o1": 1,
        "o2": 1,
        "o3": 0,
        "o4": 0
      },
      "reachability_status": "reachable",
      "region_formula": "o1=1 && o2=1 && o3=0 && o4=0",
      "proof_refs": [
        "bounded_enumeration:case_504"
      ],
      "witness_inputs": {
        "i1": 1,
        "i2": 1,
        "i3": 1,
        "i4": 1,
        "i5": 1,
        "i6": 1,
        "i7": 0,
        "i8": 0,
        "i9": 0
      }
    },
    {
      "region_id": "1101",
      "output_vector": {
        "o1": 1,
        "o2": 1,
        "o3": 0,
        "o4": 1
      },
      "reachability_status": "unreachable",
      "region_formula": "o1=1 && o2=1 && o3=0 && o4=1",
      "proof_refs": [
        "bounded_enumeration:no_case_in_explicit_domain"
      ]
    },
    {
      "region_id": "1110",
      "output_vector": {
        "o1": 1,
        "o2": 1,
        "o3": 1,
        "o4": 0
      },
      "reachability_status": "unreachable",
      "region_formula": "o1=1 && o2=1 && o3=1 && o4=0",
      "proof_refs": [
        "bounded_enumeration:no_case_in_explicit_domain"
      ]
    },
    {
      "region_id": "1111",
      "output_vector": {
        "o1": 1,
        "o2": 1,
        "o3": 1,
        "o4": 1
      },
      "reachability_status": "reachable",
      "region_formula": "o1=1 && o2=1 && o3=1 && o4=1",
      "proof_refs": [
        "bounded_enumeration:case_0"
      ],
      "witness_inputs": {
        "i1": 0,
        "i2": 0,
        "i3": 0,
        "i4": 0,
        "i5": 0,
        "i6": 0,
        "i7": 0,
        "i8": 0,
        "i9": 0
      }
    }
  ],
  "partition_checks": {
    "disjointness": "proved",
    "exhaustiveness": "proved",
    "tau_differential": "proved",
    "interpreter_equivalence": "proved"
  }
}
